{
  "schema_version": 1,
  "relationship_id": "rel.0001",
  "relationship_type": "SUPPLIES",
  "source_entity_id": "company.0001",
  "target_entity_id": "company.600519",
  "direction": "DIRECTED",
  "confidence": 0.9,
  "confirmation_status": "AUTO_ACCEPTED",
  "evidence_ids": ["evidence.0001"],
  "created_at": "2026-08-05T09:00:00+08:00",
  "updated_at": "2026-08-05T09:00:00+08:00"
}
